{
  "$schema": "https://json-schema.org/draft/2020-12/schema",
  "$id": "https://raw.githubusercontent.com/iowarp/clio-agent/develop/catalogs/codex-models.schema.json",
  "title": "CLIO Codex model catalog",
  "description": "Schema for catalogs/codex-models.json, fetched by providers/model_discovery/codex_catalog.py. Mirrors the validation _parse_catalog enforces at read time (schema_version, model id shape, positive limits, the effort-level and capability vocabularies) so CI catches a malformed commit before it reaches a client's fetch. default_model membership in models is checked at read time; JSON Schema cannot express it.",
  "type": "object",
  "required": ["schema_version", "models"],
  "additionalProperties": false,
  "properties": {
    "schema_version": { "const": 1 },
    "source": { "type": "string" },
    "default_model": { "type": "string" },
    "models": {
      "type": "array",
      "minItems": 1,
      "items": {
        "type": "object",
        "required": ["id", "name", "context_window", "max_output_tokens", "capabilities"],
        "additionalProperties": false,
        "properties": {
          "id": {
            "type": "string",
            "pattern": "^[a-z0-9]+(?:[.\\-][a-z0-9]+)*$"
          },
          "name": { "type": "string", "minLength": 1, "maxLength": 120 },
          "context_window": { "type": "integer", "exclusiveMinimum": 0 },
          "max_output_tokens": { "type": "integer", "exclusiveMinimum": 0 },
          "reasoning": { "type": "boolean" },
          "effort_levels": {
            "type": "array",
            "items": {
              "enum": ["off", "minimal", "low", "medium", "high", "xhigh", "max", "ultra"]
            }
          },
          "capabilities": {
            "type": "array",
            "minItems": 1,
            "uniqueItems": true,
            "items": { "enum": ["text", "image"] },
            "contains": { "const": "text" }
          }
        }
      }
    }
  }
}
