{
  "schema_version": 1,
  "source": "cross-checked against github.com/badlogic/pi-mono packages/ai/scripts/generate-models.ts (openai-codex-responses models)",
  "default_model": "gpt-5.6-sol",
  "models": [
    {
      "id": "gpt-6-astra",
      "name": "GPT-6 Astra",
      "context_window": 272000,
      "max_output_tokens": 128000,
      "reasoning": true,
      "effort_levels": [
        "low",
        "medium",
        "high",
        "xhigh",
        "max"
      ],
      "capabilities": [
        "text",
        "image"
      ]
    },
    {
      "id": "gpt-6-sol",
      "name": "GPT-6 Sol",
      "context_window": 272000,
      "max_output_tokens": 128000,
      "reasoning": true,
      "effort_levels": [
        "off",
        "low",
        "medium",
        "high",
        "xhigh",
        "max"
      ],
      "capabilities": [
        "text",
        "image"
      ]
    },
    {
      "id": "gpt-6-luna",
      "name": "GPT-6 Luna",
      "context_window": 272000,
      "max_output_tokens": 128000,
      "reasoning": true,
      "effort_levels": [
        "off",
        "low",
        "medium",
        "high",
        "xhigh",
        "max"
      ],
      "capabilities": [
        "text",
        "image"
      ]
    },
    {
      "id": "gpt-5.6-sol",
      "name": "GPT-5.6 Sol",
      "context_window": 272000,
      "max_output_tokens": 128000,
      "reasoning": true,
      "effort_levels": [
        "off",
        "low",
        "medium",
        "high",
        "xhigh",
        "max"
      ],
      "capabilities": [
        "text",
        "image"
      ]
    },
    {
      "id": "gpt-5.6-luna",
      "name": "GPT-5.6 Luna",
      "context_window": 272000,
      "max_output_tokens": 128000,
      "reasoning": true,
      "effort_levels": [
        "off",
        "low",
        "medium",
        "high",
        "xhigh",
        "max"
      ],
      "capabilities": [
        "text",
        "image"
      ]
    },
    {
      "id": "gpt-5.6-terra",
      "name": "GPT-5.6 Terra",
      "context_window": 272000,
      "max_output_tokens": 128000,
      "reasoning": true,
      "effort_levels": [
        "off",
        "low",
        "medium",
        "high",
        "xhigh",
        "max"
      ],
      "capabilities": [
        "text",
        "image"
      ]
    },
    {
      "id": "gpt-5.5",
      "name": "GPT-5.5",
      "context_window": 272000,
      "max_output_tokens": 128000,
      "reasoning": true,
      "effort_levels": [
        "low",
        "medium",
        "high",
        "xhigh"
      ],
      "capabilities": [
        "text",
        "image"
      ]
    },
    {
      "id": "gpt-5.3-codex-spark",
      "name": "GPT-5.3 Codex Spark",
      "context_window": 128000,
      "max_output_tokens": 128000,
      "reasoning": true,
      "effort_levels": [
        "low",
        "medium",
        "high",
        "xhigh"
      ],
      "capabilities": [
        "text"
      ]
    }
  ]
}
